{
  "run_id": "run-001",
  "prd_slug": "setup-wizard",
  "initiative": "self-service-onboarding",
  "epics": [
    {
      "id": "EPIC-001",
      "summary": "Build guided setup wizard for SMB admins",
      "description": "Enable SMB admins to complete setup without IT help",
      "labels": ["onboarding", "self-service"],
      "problem_ref": "PB-001",
      "children": [
        {
          "id": "TICKET-001",
          "type": "Story",
          "summary": "Create step-by-step wizard flow",
          "description": "Design and implement the wizard navigation",
          "labels": ["frontend", "ux"],
          "priority": "high",
          "req_ids": ["REQ-001"],
          "screen_ids": ["SCR-001", "SCR-002"],
          "acceptance_criteria": [
            "User can proceed through all steps",
            "Step 3 has contextual help"
          ],
          "blocks": [],
          "jira_key": null
        },
        {
          "id": "TICKET-002",
          "type": "Task",
          "summary": "Add validation for setup form inputs",
          "description": "Ensure form data is valid before proceeding",
          "labels": ["backend", "validation"],
          "priority": "high",
          "req_ids": ["REQ-001"],
          "screen_ids": [],
          "acceptance_criteria": [
            "Invalid inputs show clear error messages"
          ],
          "blocks": [],
          "jira_key": null
        }
      ]
    }
  ]
}
